<?xml version="1.0" encoding="UTF-8"?>
<p:productTypesLOCAL xmlns:p="http://meinnamespace.meinefirma.de" xmlns:xsi="http://www.w3.org/2001/XMLSchema-instance" xsi:schemaLocation="http://meinnamespace.meinefirma.de producttypesLOCAL.xsd ">
  <p:productType id="1">
    <p:name>delikato Joghurt Dressing Light</p:name>
    <p:stockData>
      <p:stock>1</p:stock>
      <p:minstock>0</p:minstock>
    </p:stockData>
  </p:productType>
  <p:productType id="2">
    <p:name>Milsani Frische Vollmilch</p:name>
    <p:stockData>
      <p:stock>3</p:stock>
      <p:minstock>1</p:minstock>
    </p:stockData>
  </p:productType>
</p:productTypesLOCAL>
